<?xml version="1.0" encoding="UTF-8"?>
<factura
  xmlns:xs="http://www.w3.org/2001/XMLSchema-instance"
  xs:noNamespaceSchemaLocation="factura.xsd">
  <numero>1</numero>
  <client>
    <nom>Ediciones Paraninfo S.A.</nom>
    <CIF>A81461477</CIF>
  </client>
  <concepte>
    <descripcio>Imprempta</descripcio>
    <import>1000</import>
  </concepte>
  <concepte>
    <descripcio>Maquetaci√≥</descripcio>
    <import>500.50</import>
  </concepte>
  <impost nom="IVA">PENDENT</impost>
  <totalFactura euros="1500.50"/>
</factura>